{
 "form": "ipk",
 "variants": [
  {
   "id": "lc",
   "title": "лицо – ЛЦ"
  },
  {
   "id": "pr",
   "title": "событие – ПР"
  }
 ],
 "title": "ИНФОРМАЦИОННО-ПОИСКОВАЯ КАРТА (ИПК)",
 "edition": "2026",
 "effective_from": "2026-01-01",
 "effective_to": null,
 "legal_basis": "эталонный бланк заказчика",
 "source": "new_cards/ИПК.doc (нормализован в .docx нативным Word); реквизиты извлечены scripts/import/import_ipk.py",
 "requisites_count": 72,
 "requisites": [
  {
   "id": "02",
   "number": "02",
   "label": "Фамилия",
   "label_status": "source",
   "field_type": "text",
   "classifier_no": null,
   "options": [],
   "multiple": null,
   "has_text": true,
   "has_date": false,
   "section": "Сведения о лице",
   "fills_by": "investigator",
   "raw": null,
   "input": {},
   "variants": [
    "lc"
   ]
  },
  {
   "id": "03",
   "number": "03",
   "label": "Имя",
   "label_status": "source",
   "field_type": "text",
   "classifier_no": null,
   "options": [],
   "multiple": null,
   "has_text": true,
   "has_date": false,
   "section": "Сведения о лице",
   "fills_by": "investigator",
   "raw": null,
   "input": {},
   "variants": [
    "lc"
   ]
  },
  {
   "id": "4",
   "number": "4",
   "label": "Отчество",
   "label_status": "source",
   "field_type": "text",
   "classifier_no": null,
   "options": [],
   "multiple": null,
   "has_text": true,
   "has_date": false,
   "section": "Сведения о лице",
   "fills_by": "investigator",
   "raw": null,
   "input": {},
   "variants": [
    "lc"
   ]
  },
  {
   "id": "05",
   "number": "05",
   "label": "Дата рождения",
   "label_status": "source",
   "field_type": "date",
   "classifier_no": null,
   "options": [],
   "multiple": null,
   "has_text": false,
   "has_date": true,
   "section": "Сведения о лице",
   "fills_by": "investigator",
   "raw": null,
   "input": {},
   "variants": [
    "lc"
   ]
  },
  {
   "id": "06",
   "number": "06",
   "label": "Паспорт (другой документ, удостоверение личности, свидетельство)",
   "label_status": "source",
   "field_type": "text",
   "classifier_no": null,
   "options": [],
   "multiple": null,
   "has_text": true,
   "has_date": false,
   "section": "Сведения о лице",
   "fills_by": "investigator",
   "raw": null,
   "input": {},
   "variants": [
    "lc"
   ]
  },
  {
   "id": "07",
   "number": "07",
   "label": "Место рождения: республика; край, область; район; населенный пункт",
   "label_status": "source",
   "field_type": "text",
   "classifier_no": null,
   "options": [],
   "multiple": null,
   "has_text": true,
   "has_date": false,
   "section": "Сведения о лице",
   "fills_by": "investigator",
   "raw": null,
   "input": {},
   "variants": [
    "lc"
   ]
  },
  {
   "id": "08",
   "number": "08",
   "label": "Адрес: республика; край, область; район; населенный пункт; улица; дом; корпус; квартира; микрорайон; административный участок",
   "label_status": "source",
   "field_type": "text",
   "classifier_no": null,
   "options": [],
   "multiple": null,
   "has_text": true,
   "has_date": false,
   "section": "Сведения о лице",
   "fills_by": "investigator",
   "raw": null,
   "input": {},
   "variants": [
    "lc"
   ]
  },
  {
   "id": "09",
   "number": "09",
   "label": "Адрес фактического проживания: республика; край, область; район; населенный пункт; улица; дом; корпус; квартира; микрорайон; административный участок",
   "label_status": "source",
   "field_type": "text",
   "classifier_no": null,
   "options": [],
   "multiple": null,
   "has_text": true,
   "has_date": false,
   "section": "Сведения о лице",
   "fills_by": "investigator",
   "raw": null,
   "input": {},
   "variants": [
    "lc"
   ]
  },
  {
   "id": "70",
   "number": "70",
   "label": "Гражданство",
   "label_status": "source",
   "field_type": "text",
   "classifier_no": null,
   "options": [],
   "multiple": null,
   "has_text": true,
   "has_date": false,
   "section": "Сведения о лице",
   "fills_by": "investigator",
   "raw": null,
   "input": {},
   "variants": [
    "lc"
   ]
  },
  {
   "id": "10",
   "number": "10",
   "label": "Национальность",
   "label_status": "source",
   "field_type": "text",
   "classifier_no": null,
   "options": [],
   "multiple": null,
   "has_text": true,
   "has_date": false,
   "section": "Сведения о лице",
   "fills_by": "investigator",
   "raw": null,
   "input": {},
   "variants": [
    "lc"
   ]
  },
  {
   "id": "11",
   "number": "11",
   "label": "Место работы",
   "label_status": "source",
   "field_type": "text",
   "classifier_no": null,
   "options": [],
   "multiple": null,
   "has_text": true,
   "has_date": false,
   "section": "Сведения о лице",
   "fills_by": "investigator",
   "raw": null,
   "input": {},
   "variants": [
    "lc"
   ]
  },
  {
   "id": "12",
   "number": "12",
   "label": "Специальность",
   "label_status": "source",
   "field_type": "text",
   "classifier_no": null,
   "options": [],
   "multiple": null,
   "has_text": true,
   "has_date": false,
   "section": "Сведения о лице",
   "fills_by": "investigator",
   "raw": null,
   "input": {},
   "variants": [
    "lc"
   ]
  },
  {
   "id": "13",
   "number": "13",
   "label": "Клички",
   "label_status": "source",
   "field_type": "text",
   "classifier_no": null,
   "options": [],
   "multiple": null,
   "has_text": true,
   "has_date": false,
   "section": "Сведения о лице",
   "fills_by": "investigator",
   "raw": null,
   "input": {},
   "variants": [
    "lc"
   ]
  },
  {
   "id": "14",
   "number": "14",
   "label": "Выезжает, посещает (республика, край, область, район, населенный пункт, улица, дом, корпус или наименование объекта)",
   "label_status": "source",
   "field_type": "text",
   "classifier_no": null,
   "options": [],
   "multiple": null,
   "has_text": true,
   "has_date": false,
   "section": "Сведения о лице",
   "fills_by": "investigator",
   "raw": null,
   "input": {},
   "variants": [
    "lc"
   ]
  },
  {
   "id": "15",
   "number": "15",
   "label": "Порочные наклонности",
   "label_status": "source",
   "field_type": "enum",
   "classifier_no": null,
   "options": [
    {
     "code": "1",
     "value": "симуляция",
     "group": null
    },
    {
     "code": "2",
     "value": "алкоголизм",
     "group": null
    },
    {
     "code": "3",
     "value": "токсикомания",
     "group": null
    },
    {
     "code": "4",
     "value": "наркомания",
     "group": null
    },
    {
     "code": "6",
     "value": "садизм",
     "group": null
    },
    {
     "code": "8",
     "value": "половые извращения",
     "group": null
    }
   ],
   "multiple": true,
   "has_text": false,
   "has_date": false,
   "section": "Сведения о лице",
   "fills_by": "investigator",
   "raw": null,
   "input": {
    "select": "multiple"
   },
   "variants": [
    "lc"
   ]
  },
  {
   "id": "16",
   "number": "16",
   "label": "Интересы",
   "label_status": "source",
   "field_type": "enum",
   "classifier_no": null,
   "options": [
    {
     "code": "1",
     "value": "азартные игры",
     "group": null
    },
    {
     "code": "3",
     "value": "коллекционирование",
     "group": null
    },
    {
     "code": "5",
     "value": "музыка",
     "group": null
    },
    {
     "code": "7",
     "value": "охота, рыбалка",
     "group": null
    },
    {
     "code": "9",
     "value": "радиодело",
     "group": null
    },
    {
     "code": "11",
     "value": "религия",
     "group": null
    },
    {
     "code": "13",
     "value": "спорт",
     "group": null
    },
    {
     "code": "15",
     "value": "театр",
     "group": null
    },
    {
     "code": "17",
     "value": "фотодело",
     "group": null
    },
    {
     "code": "19",
     "value": "автодело",
     "group": null
    }
   ],
   "multiple": true,
   "has_text": false,
   "has_date": false,
   "section": "Сведения о лице",
   "fills_by": "investigator",
   "raw": null,
   "input": {
    "select": "multiple"
   },
   "variants": [
    "lc"
   ]
  },
  {
   "id": "17",
   "number": "17",
   "label": "Имеет навык",
   "label_status": "source",
   "field_type": "enum",
   "classifier_no": null,
   "options": [
    {
     "code": "12",
     "value": "бокса",
     "group": null
    },
    {
     "code": "14",
     "value": "борьбы",
     "group": null
    },
    {
     "code": "2",
     "value": "автомобиля",
     "group": "вождения"
    },
    {
     "code": "4",
     "value": "катера",
     "group": "вождения"
    },
    {
     "code": "6",
     "value": "мотоцикла",
     "group": "вождения"
    },
    {
     "code": "8",
     "value": "самолета",
     "group": "вождения"
    },
    {
     "code": "10",
     "value": "трактора",
     "group": "вождения"
    }
   ],
   "multiple": true,
   "has_text": false,
   "has_date": false,
   "section": "Сведения о лице",
   "fills_by": "investigator",
   "raw": null,
   "input": {
    "select": "multiple"
   },
   "variants": [
    "lc"
   ]
  },
  {
   "id": "18",
   "number": "18",
   "label": "Знает язык",
   "label_status": "source",
   "field_type": "text",
   "classifier_no": null,
   "options": [],
   "multiple": null,
   "has_text": true,
   "has_date": false,
   "section": "Сведения о лице",
   "fills_by": "investigator",
   "raw": null,
   "input": {},
   "variants": [
    "lc"
   ]
  },
  {
   "id": "22",
   "number": "22",
   "label": "Вид документа",
   "label_status": "source",
   "field_type": "enum",
   "classifier_no": null,
   "options": [
    {
     "code": "25",
     "value": "УД",
     "group": null
    }
   ],
   "multiple": false,
   "has_text": false,
   "has_date": false,
   "section": "Документ, эпизод, решение",
   "fills_by": "investigator",
   "raw": null,
   "input": {
    "select": "single"
   },
   "variants": [
    "lc",
    "pr"
   ]
  },
  {
   "id": "23",
   "number": "23",
   "label": "Номер документа",
   "label_status": "source",
   "field_type": "text",
   "classifier_no": null,
   "options": [],
   "multiple": null,
   "has_text": true,